[
  { "name": "--yeti-base", "group": "scale", "public": true, "declared": false, "default": "unset", "description": "Set to pin the body size at one value for every viewport; overrides both --yeti-base-min and --yeti-base-max." },
  { "name": "--yeti-ratio", "group": "scale", "public": true, "declared": false, "default": "unset", "description": "Set to pin the scale ratio at one value for every viewport; overrides both --yeti-ratio-min and --yeti-ratio-max." },
  { "name": "--yeti-base-min", "group": "scale", "public": true, "default": "1rem", "description": "Body text size at the narrow viewport." },
  { "name": "--yeti-base-max", "group": "scale", "public": true, "default": "1.125rem", "description": "Body text size at the wide viewport." },
  { "name": "--yeti-ratio-min", "group": "scale", "public": true, "default": "1.2", "description": "Scale ratio at the narrow viewport (minor third)." },
  { "name": "--yeti-ratio-max", "group": "scale", "public": true, "default": "1.333", "description": "Scale ratio at the wide viewport (perfect fourth)." },
  { "name": "--yeti-viewport-min", "group": "scale", "public": true, "default": "320px", "description": "Viewport width at which the narrow values apply." },
  { "name": "--yeti-viewport-max", "group": "scale", "public": true, "default": "1280px", "description": "Viewport width at which the wide values apply." },
  { "name": "--yeti-space-none", "group": "space", "public": true, "default": "0", "description": "No space; the value behind data-gap=\"none\"." },
  { "name": "--yeti-space-xs", "group": "space", "public": true, "default": "step -2", "description": "Hairline gap." },
  { "name": "--yeti-space-sm", "group": "space", "public": true, "default": "step -1", "description": "Tight gap." },
  { "name": "--yeti-space-md", "group": "space", "public": true, "default": "step 0", "description": "Default gap; equals the body text size." },
  { "name": "--yeti-space-lg", "group": "space", "public": true, "default": "step 1", "description": "Comfortable gap." },
  { "name": "--yeti-space-xl", "group": "space", "public": true, "default": "step 2", "description": "Section gap." },
  { "name": "--yeti-space-2xl", "group": "space", "public": true, "default": "step 3", "description": "Page-level gap." },
  { "name": "--yeti-space-3xl", "group": "space", "public": true, "default": "step 4", "description": "Hero-level gap." },
  { "name": "--yeti-space-xs-static", "group": "space", "public": true, "default": "step -2, narrow viewport value", "description": "Non-fluid xs, for a gap that must not scale." },
  { "name": "--yeti-space-sm-static", "group": "space", "public": true, "default": "step -1, narrow viewport value", "description": "Non-fluid sm." },
  { "name": "--yeti-space-md-static", "group": "space", "public": true, "default": "step 0, narrow viewport value", "description": "Non-fluid md." },
  { "name": "--yeti-space-lg-static", "group": "space", "public": true, "default": "step 1, narrow viewport value", "description": "Non-fluid lg." },
  { "name": "--yeti-space-xl-static", "group": "space", "public": true, "default": "step 2, narrow viewport value", "description": "Non-fluid xl." },
  { "name": "--yeti-space-2xl-static", "group": "space", "public": true, "default": "step 3, narrow viewport value", "description": "Non-fluid 2xl." },
  { "name": "--yeti-space-3xl-static", "group": "space", "public": true, "default": "step 4, narrow viewport value", "description": "Non-fluid 3xl." },
  { "name": "--yeti-radius-sm", "group": "radius", "public": true, "default": "0.25 × base", "description": "Small corner radius; inputs, code, badges." },
  { "name": "--yeti-radius-md", "group": "radius", "public": true, "default": "0.5 × base", "description": "Medium corner radius; cards, dialogs." },
  { "name": "--yeti-radius-lg", "group": "radius", "public": true, "default": "1 × base", "description": "Large corner radius; hero panels." },
  { "name": "--yeti-radius-full", "group": "radius", "public": true, "default": "9999px", "description": "Pill or circle." },
  { "name": "--yeti-width-2xs", "group": "width", "public": true, "default": "12rem", "description": "The narrowest named width: three of them fit a reading column, which sixteen rem does not." },
  { "name": "--yeti-width-xs", "group": "width", "public": true, "default": "16rem", "description": "Smallest container measure; the grid's default minimum column width." },
  { "name": "--yeti-width-sm", "group": "width", "public": true, "default": "24rem", "description": "The sidebar's default width." },
  { "name": "--yeti-width-md", "group": "width", "public": true, "default": "32rem", "description": "The columns layout's default threshold." },
  { "name": "--yeti-width-lg", "group": "width", "public": true, "default": "48rem", "description": "A narrow page column." },
  { "name": "--yeti-width-xl", "group": "width", "public": true, "default": "64rem", "description": "The center layout's default maximum." },
  { "name": "--yeti-width-2xl", "group": "width", "public": true, "default": "80rem", "description": "A wide page column." },
  { "name": "--yeti-height-sm", "group": "height", "public": true, "default": "12rem", "description": "Block size at data-height=\"sm\"; the demo's preview box is the first taker." },
  { "name": "--yeti-height-md", "group": "height", "public": true, "default": "20rem", "description": "Block size at data-height=\"md\", and with no attribute." },
  { "name": "--yeti-height-lg", "group": "height", "public": true, "default": "32rem", "description": "Block size at data-height=\"lg\"." },
  { "name": "--yeti-height-xl", "group": "height", "public": true, "default": "48rem", "description": "Block size at data-height=\"xl\"." },
  { "name": "--yeti-height-half", "group": "height", "public": true, "default": "50dvh", "description": "Block size at data-height=\"half\": half the viewport, dynamic so it tracks the browser chrome on phones." },
  { "name": "--yeti-text-xs", "group": "text", "public": true, "default": "step -2", "description": "Captions and fine print." },
  { "name": "--yeti-text-sm", "group": "text", "public": true, "default": "step -1", "description": "Small text; h6." },
  { "name": "--yeti-text-md", "group": "text", "public": true, "default": "step 0", "description": "Body text; h5 in bold." },
  { "name": "--yeti-text-lg", "group": "text", "public": true, "default": "step 1", "description": "Lead paragraphs; h4." },
  { "name": "--yeti-text-xl", "group": "text", "public": true, "default": "step 2", "description": "h3." },
  { "name": "--yeti-text-2xl", "group": "text", "public": true, "default": "step 3", "description": "h2." },
  { "name": "--yeti-text-3xl", "group": "text", "public": true, "default": "step 4", "description": "h1." },
  { "name": "--yeti-text-display", "group": "text", "public": true, "default": "step 5", "description": "Display type, larger than any heading." },
  { "name": "--yeti-leading-md", "group": "text", "public": true, "default": "1em + 0.5 × base", "description": "Body line height; about 1.5 at body size, tightening as type grows." },
  { "name": "--yeti-leading-sm", "group": "text", "public": true, "default": "1.5", "description": "Line height for text set below the body size, such as a code block; a ratio, so it shrinks with the type." },
  { "name": "--yeti-leading-tight", "group": "text", "public": true, "default": "1.15", "description": "Heading line height." },
  { "name": "--yeti-measure", "group": "text", "public": true, "default": "70ch", "description": "Maximum line length for prose." },
  { "name": "--yeti-list-gap", "group": "text", "public": true, "default": "0.25rem", "description": "Space between one item of a prose list and the next." },
  { "name": "--yeti-lede-size", "group": "text", "public": true, "default": "var(--yeti-text-lg)", "description": "How large a lede reads." },
  { "name": "--yeti-lede-measure", "group": "text", "public": true, "default": "50ch", "description": "A lede's line length. Moves with --yeti-lede-size, since ch is a unit of the font." },
  { "name": "--yeti-font-sans", "group": "font", "public": true, "default": "system-ui, sans-serif", "description": "Default text face. Yeti ships no web fonts; override this to use yours." },
  { "name": "--yeti-font-mono", "group": "font", "public": true, "default": "ui-monospace, monospace", "description": "Code face." },
  { "name": "--yeti-duration-fast", "group": "motion", "public": true, "default": "150ms", "description": "Quick transitions; hover and focus. Collapses to 0.01ms under prefers-reduced-motion." },
  { "name": "--yeti-duration-base", "group": "motion", "public": true, "default": "250ms", "description": "Standard transitions; open and close. Collapses under prefers-reduced-motion." },
  { "name": "--yeti-ease", "group": "motion", "public": true, "default": "cubic-bezier(0.2, 0, 0, 1)", "description": "Default easing; fast out, gentle in." },
  { "name": "--yeti-motion-iterations", "group": "motion", "public": true, "default": "infinite", "description": "Iteration count for animations that run forever, such as the spinner. Collapses to 1 under prefers-reduced-motion, because a component's own infinite would outrank the reset and keep running at a random phase every frame." },
  { "name": "--yeti-page-duration", "group": "motion", "public": true, "default": "200ms", "description": "How long the crossfade between two pages takes, for a site that has turned cross-document view transitions on. Collapses to 0.01ms under prefers-reduced-motion, which is the only thing that stills a page transition." },
  { "name": "--yeti-page-ease", "group": "motion", "public": true, "default": "ease", "description": "The curve that crossfade runs on. Symmetric, unlike --yeti-ease, because neither end of a page change leads." },